{
  "id": "user.test-1761677813138",
  "name": "Test",
  "description": "Test",
  "version": "1.0.0",
  "createdAt": "2025-10-28T18:56:53.138Z",
  "updatedAt": "2025-10-28T18:56:53.138Z",
  "category": "general",
  "tags": [
    "test",
    "test2"
  ],
  "author": {
    "name": "User",
    "email": "user@local"
  },
  "license": "MIT",
  "source": "user",
  "items": [],
  "itemCount": 0,
  "scope": "project",
  "versionHistory": [],
  "auditLog": [
    {
      "id": "audit-1761677813138-nguo5hb7x",
      "timestamp": "2025-10-28T18:56:53.138Z",
      "operation": "template.created",
      "actor": "user",
      "details": {}
    }
  ]
}