{
  "id": "user.test2-1761304641781",
  "name": "test2",
  "description": "rghahqh",
  "version": "1.0.0",
  "createdAt": "2025-10-24T11:17:21.781Z",
  "updatedAt": "2025-10-24T11:17:21.781Z",
  "category": "development",
  "tags": [],
  "author": {
    "name": "User",
    "email": "user@local"
  },
  "license": "MIT",
  "source": "user",
  "items": [],
  "itemCount": 0,
  "scope": "personal",
  "versionHistory": [],
  "auditLog": [
    {
      "id": "audit-1761304641781-ycnlqpier",
      "timestamp": "2025-10-24T11:17:21.781Z",
      "operation": "template.created",
      "actor": "user",
      "details": {}
    }
  ]
}